{
  "beats": [
    {
      "claims": {
        "forbiddenAddition": "PB or pace judgement without comparison fact",
        "globalForbiddenClaimTypes": [
          "unbound.cause",
          "unbound.intent",
          "unbound.emotion",
          "unsupported.certainty",
          "unsupported.future_outcome",
          "unsupported.weather_inference",
          "unsupported.medical_inference",
          "unbound.entity",
          "unbound.number",
          "unbound.unit"
        ],
        "normativeSignature": "timing.lap_completed(hero; lap[, lapTime])",
        "referenceRequirements": [],
        "required": [
          {
            "actorFrame": "hero",
            "attributeEquals": {},
            "id": "timing.lap_completed",
            "kind": "predicate",
            "maxClaims": 1,
            "minClaims": 1,
            "optionalAttributes": [
              "lapTime"
            ],
            "requiredAttributes": [
              "lap"
            ]
          }
        ]
      },
      "group": "timing",
      "hardContext": {
        "broadcastContext": {
          "mode": "ignore",
          "values": []
        },
        "normativeText": "any-stage; completed lap fact",
        "scopeModes": [
          "occurrence"
        ],
        "stageAnyOf": [
          "practice",
          "qualifying",
          "race"
        ],
        "vehiclePhaseAnyOf": []
      },
      "id": "timing.lap.completed",
      "lifecycleText": "lap edge / self-contained terminal",
      "policyId": "result",
      "realization": {
        "backend": "authored",
        "family": "timing.lap_result",
        "maxFreedom": "tight",
        "requiredPatternCardCount": 4
      },
      "role": "result",
      "storyRoutes": [
        "timing_attempt",
        "single_result"
      ],
      "tapeChannel": "race.timing.lap",
      "triggers": [
        {
          "id": "LAP_COMPLETE",
          "kind": "accepted_event"
        }
      ]
    },
    {
      "claims": {
        "forbiddenAddition": "session/field best unless explicitly bound",
        "globalForbiddenClaimTypes": [
          "unbound.cause",
          "unbound.intent",
          "unbound.emotion",
          "unsupported.certainty",
          "unsupported.future_outcome",
          "unsupported.weather_inference",
          "unsupported.medical_inference",
          "unbound.entity",
          "unbound.number",
          "unbound.unit"
        ],
        "normativeSignature": "timing.personal_best(hero; lapTime, referenceTime, improvement)",
        "referenceRequirements": [],
        "required": [
          {
            "actorFrame": "hero",
            "attributeEquals": {},
            "id": "timing.personal_best",
            "kind": "predicate",
            "maxClaims": 1,
            "minClaims": 1,
            "optionalAttributes": [],
            "requiredAttributes": [
              "lapTime",
              "referenceTime",
              "improvement"
            ]
          }
        ]
      },
      "group": "timing",
      "hardContext": {
        "broadcastContext": {
          "mode": "ignore",
          "values": []
        },
        "normativeText": "any-stage; PB comparison valid",
        "scopeModes": [
          "occurrence"
        ],
        "stageAnyOf": [
          "practice",
          "qualifying",
          "race"
        ],
        "vehiclePhaseAnyOf": []
      },
      "id": "timing.lap.personal_best",
      "lifecycleText": "PB edge / self-contained terminal",
      "policyId": "result",
      "realization": {
        "backend": "authored",
        "family": "timing.lap_result",
        "maxFreedom": "tight",
        "requiredPatternCardCount": 4
      },
      "role": "result",
      "storyRoutes": [
        "timing_attempt",
        "single_result"
      ],
      "tapeChannel": "race.timing.lap",
      "triggers": [
        {
          "id": "PERSONAL_BEST",
          "kind": "accepted_event"
        }
      ]
    },
    {
      "claims": {
        "forbiddenAddition": "completed result or guaranteed target",
        "globalForbiddenClaimTypes": [
          "unbound.cause",
          "unbound.intent",
          "unbound.emotion",
          "unsupported.certainty",
          "unsupported.future_outcome",
          "unsupported.weather_inference",
          "unsupported.medical_inference",
          "unbound.entity",
          "unbound.number",
          "unbound.unit"
        ],
        "normativeSignature": "timing.delta_improved(hero; delta, referenceId, segmentId)",
        "referenceRequirements": [],
        "required": [
          {
            "actorFrame": "hero",
            "attributeEquals": {},
            "id": "timing.delta_improved",
            "kind": "predicate",
            "maxClaims": 1,
            "minClaims": 1,
            "optionalAttributes": [],
            "requiredAttributes": [
              "delta",
              "referenceId",
              "segmentId"
            ]
          }
        ]
      },
      "group": "timing",
      "hardContext": {
        "broadcastContext": {
          "mode": "ignore",
          "values": []
        },
        "normativeText": "practice or qualifying; valid delta",
        "scopeModes": [
          "occurrence"
        ],
        "stageAnyOf": [
          "practice",
          "qualifying"
        ],
        "vehiclePhaseAnyOf": []
      },
      "id": "timing.pace.gain",
      "lifecycleText": "material gain / lap/reset",
      "policyId": "transient",
      "realization": {
        "backend": "qwen_compiled",
        "family": "timing.delta",
        "maxFreedom": "tight",
        "requiredPatternCardCount": 4
      },
      "role": "update",
      "storyRoutes": [
        "timing_attempt",
        "single_result"
      ],
      "tapeChannel": "race.timing.delta",
      "triggers": [
        {
          "id": "GAIN_FOUND",
          "kind": "accepted_event"
        }
      ]
    },
    {
      "claims": {
        "forbiddenAddition": "cause of loss",
        "globalForbiddenClaimTypes": [
          "unbound.cause",
          "unbound.intent",
          "unbound.emotion",
          "unsupported.certainty",
          "unsupported.future_outcome",
          "unsupported.weather_inference",
          "unsupported.medical_inference",
          "unbound.entity",
          "unbound.number",
          "unbound.unit"
        ],
        "normativeSignature": "timing.delta_worsened(hero; delta, referenceId, segmentId)",
        "referenceRequirements": [],
        "required": [
          {
            "actorFrame": "hero",
            "attributeEquals": {},
            "id": "timing.delta_worsened",
            "kind": "predicate",
            "maxClaims": 1,
            "minClaims": 1,
            "optionalAttributes": [],
            "requiredAttributes": [
              "delta",
              "referenceId",
              "segmentId"
            ]
          }
        ]
      },
      "group": "timing",
      "hardContext": {
        "broadcastContext": {
          "mode": "ignore",
          "values": []
        },
        "normativeText": "practice or qualifying; valid delta",
        "scopeModes": [
          "occurrence"
        ],
        "stageAnyOf": [
          "practice",
          "qualifying"
        ],
        "vehiclePhaseAnyOf": []
      },
      "id": "timing.pace.loss",
      "lifecycleText": "material loss / lap/reset",
      "policyId": "transient",
      "realization": {
        "backend": "qwen_compiled",
        "family": "timing.delta",
        "maxFreedom": "tight",
        "requiredPatternCardCount": 4
      },
      "role": "update",
      "storyRoutes": [
        "timing_attempt",
        "single_result"
      ],
      "tapeChannel": "race.timing.delta",
      "triggers": [
        {
          "id": "TIME_LOST",
          "kind": "accepted_event"
        }
      ]
    },
    {
      "claims": {
        "forbiddenAddition": "sector-best claim",
        "globalForbiddenClaimTypes": [
          "unbound.cause",
          "unbound.intent",
          "unbound.emotion",
          "unsupported.certainty",
          "unsupported.future_outcome",
          "unsupported.weather_inference",
          "unsupported.medical_inference",
          "unbound.entity",
          "unbound.number",
          "unbound.unit"
        ],
        "normativeSignature": "timing.sector_completed(hero; sectorId, segmentTime[, delta])",
        "referenceRequirements": [],
        "required": [
          {
            "actorFrame": "hero",
            "attributeEquals": {},
            "id": "timing.sector_completed",
            "kind": "predicate",
            "maxClaims": 1,
            "minClaims": 1,
            "optionalAttributes": [
              "delta"
            ],
            "requiredAttributes": [
              "sectorId",
              "segmentTime"
            ]
          }
        ]
      },
      "group": "timing",
      "hardContext": {
        "broadcastContext": {
          "mode": "ignore",
          "values": []
        },
        "normativeText": "any-stage; sector identity",
        "scopeModes": [
          "occurrence"
        ],
        "stageAnyOf": [
          "practice",
          "qualifying",
          "race"
        ],
        "vehiclePhaseAnyOf": []
      },
      "id": "timing.sector.split",
      "lifecycleText": "sector edge / next sector/lap",
      "policyId": "transient",
      "realization": {
        "backend": "qwen_compiled",
        "family": "timing.sector",
        "maxFreedom": "tight",
        "requiredPatternCardCount": 4
      },
      "role": "update",
      "storyRoutes": [
        "timing_attempt",
        "single_result"
      ],
      "tapeChannel": "race.timing.sector",
      "triggers": [
        {
          "id": "SECTOR_SPLIT",
          "kind": "accepted_event"
        }
      ]
    },
    {
      "claims": {
        "forbiddenAddition": "lap/PB claim",
        "globalForbiddenClaimTypes": [